Item Title,Publication Title,Book Series Title,Journal Volume,Journal Issue,Item DOI,Authors,Publication Year,URL,Content Type
"Direct push–pull or assisted push–pull? Toward optimal video content delivery using shared storage-based cloud CDN (SS-CCDN)","The Journal of Supercomputing","","75","4","10.1007/s11227-018-2696-8","S. SajithabanuS. R. Balasundaram","2019","http://link.springer.com/article/10.1007/s11227-018-2696-8","Article"
"A cognitive/intelligent resource provisioning for cloud computing services: opportunities and challenges","Soft Computing","","23","19","10.1007/s00500-019-04061-9","Mahfoudh Saeed Al-AsalyMohammad Mehedi HassanAhmed Alsanad","2019","http://link.springer.com/article/10.1007/s00500-019-04061-9","Article"
"A novel optimized approach for resource reservation in cloud computing using producer–consumer theory of microeconomics","The Journal of Supercomputing","","75","11","10.1007/s11227-019-02951-1","Alireza MohammadiMohammad Hossein Rezvani","2019","http://link.springer.com/article/10.1007/s11227-019-02951-1","Article"
"Query optimization in cloud environments: challenges, taxonomy, and techniques","The Journal of Supercomputing","","75","8","10.1007/s11227-019-02806-9","Abderrazak SebaaAbdelkamel Tari","2019","http://link.springer.com/article/10.1007/s11227-019-02806-9","Article"
"Energy-efficient Nature-Inspired techniques in Cloud computing datacenters","Telecommunication Systems","","71","2","10.1007/s11235-019-00549-9","Mohammed Joda UsmanAbdul Samad IsmailGaddafi Abdul-SalaamHassan ChizariOmprakash KaiwartyaAbdulsalam Yau GitalMuhammed AbdullahiAhmed AliyuSalihu Idi Dishing","2019","http://link.springer.com/article/10.1007/s11235-019-00549-9","Article"
"Energy-aware virtual machine allocation and selection in cloud data centers","Soft Computing","","23","6","10.1007/s00500-017-2905-z","V. Dinesh ReddyG. R. GangadharanG. Subrahmanya V. R. K. Rao","2019","http://link.springer.com/article/10.1007/s00500-017-2905-z","Article"
"Implementation of an Environmental Quality and Harmful Gases Monitoring System in Cloud","Journal of Medical and Biological Engineering","","39","4","10.1007/s40846-018-0383-0","Chao-Tung YangShuo-Tsung ChenChih-Hung ChangWalter DenChia-Cheng Wu","2019","http://link.springer.com/article/10.1007/s40846-018-0383-0","Article"
"A new computing environment for collective privacy protection from constrained healthcare devices to IoT cloud services","Cluster Computing","","22","1","10.1007/s10586-017-1298-1","Ahmed M. ElmiserySeungmin RhoMohamed Aborizka","2019","http://link.springer.com/article/10.1007/s10586-017-1298-1","Article"
"Design, simulation and testing of a cloud platform for sharing digital fabrication resources for education","Journal of Cloud Computing","","8","1","10.1186/s13677-019-0135-x","Gianluca CornettaJavier MateosAbdellah TouhafiGabriel-Miro Muntean","2019","http://link.springer.com/article/10.1186/s13677-019-0135-x","Article"
"SLA-RALBA: cost-efficient and resource-aware load balancing algorithm for cloud computing","The Journal of Supercomputing","","75","10","10.1007/s11227-019-02916-4","Altaf HussainMuhammad AleemMuhammad Azhar IqbalMuhammad Arshad Islam","2019","http://link.springer.com/article/10.1007/s11227-019-02916-4","Article"
"Ontology-based code snippets management in a cloud environment","Journal of Ambient Intelligence and Humanized Computing","","10","8","10.1007/s12652-018-0701-y","Jianjun ShiWeixing JiZhiwei GaoYujin GaoYizhuo WangXinyi LiaoFeng Shi","2019","http://link.springer.com/article/10.1007/s12652-018-0701-y","Article"
"An efficient and improved multi-objective optimized replication management with dynamic and cost aware strategies in cloud computing data center","Cluster Computing","","22","5","10.1007/s10586-017-1313-6","E. Bijolin EdwinP. UmamaheswariM. Roshni Thanka","2019","http://link.springer.com/article/10.1007/s10586-017-1313-6","Article"
"Differential cloud adoption: A comparative case study of large enterprises and SMEs in Germany","Information Systems Frontiers","","21","4","10.1007/s10796-017-9781-z","Surya KarunagaranSaji K MathewFranz Lehner","2019","http://link.springer.com/article/10.1007/s10796-017-9781-z","Article"
"Migrating parallel applications to the cloud: assessing cloud readiness based on parallel design decisions","SICS Software-Intensive Cyber-Physical Systems","","34","2 - 3","10.1007/s00450-019-00396-8","Stefan KehrerWolfgang Blochinger","2019","http://link.springer.com/article/10.1007/s00450-019-00396-8","Article"
"RETRACTED ARTICLE: A FCM cluster: cloud networking model for intelligent transportation in the city of Macau","Cluster Computing","","22","1","10.1007/s10586-017-1216-6","Zhiming CaiLianbing DengDaming LiXiang YaoHaoxiang Wang","2019","http://link.springer.com/article/10.1007/s10586-017-1216-6","Article"
"An exponent based error detection mechanism against DXDOS attack for improving the security in cloud","Cluster Computing","","22","2","10.1007/s10586-018-2261-5","J. VijayalakshmiC. R. Rene Robin","2019","http://link.springer.com/article/10.1007/s10586-018-2261-5","Article"
"An intelligent hybrid model for power flow optimization in the cloud-IOT electrical distribution network","Cluster Computing","","22","6","10.1007/s10586-017-1270-0","Yantian ZhangHaoxiang WangYanzhao Xie","2019","http://link.springer.com/article/10.1007/s10586-017-1270-0","Article"
"TASM: technocrat ARIMA and SVR model for workload prediction of web applications in cloud","Cluster Computing","","22","2","10.1007/s10586-018-2868-6","Parminder SinghPooja GuptaKiran Jyoti","2019","http://link.springer.com/article/10.1007/s10586-018-2868-6","Article"
"Light-Weight Video Codec at Terminal for Video Coding in the Cloud","Journal of Signal Processing Systems","","91","6","10.1007/s11265-018-1364-9","Ted Chih-Wei LeiFan-Shuo Tseng","2019","http://link.springer.com/article/10.1007/s11265-018-1364-9","Article"
"Host load prediction in cloud computing using Long Short-Term Memory Encoder–Decoder","The Journal of Supercomputing","","75","11","10.1007/s11227-019-02967-7","Hoang Minh NguyenGaurav KalraDaeyoung Kim","2019","http://link.springer.com/article/10.1007/s11227-019-02967-7","Article"
"An energy-efficient cloud system with novel dynamic resource allocation methods","The Journal of Supercomputing","","75","8","10.1007/s11227-019-02794-w","Chao-Tung YangShuo-Tsung ChenJung-Chun LiuYu-Wei ChanChien-Chih ChenVinod Kumar Verma","2019","http://link.springer.com/article/10.1007/s11227-019-02794-w","Article"
"RLPAS: Reinforcement Learning-based Proactive Auto-Scaler for Resource Provisioning in Cloud Environment","Mobile Networks and Applications","","24","4","10.1007/s11036-018-0996-0","J. V. Bibal BenifaD. Dejey","2019","http://link.springer.com/article/10.1007/s11036-018-0996-0","Article"
"Study on the application of cloud computing and speech recognition technology in English teaching","Cluster Computing","","22","4","10.1007/s10586-018-2115-1","Lili Wei","2019","http://link.springer.com/article/10.1007/s10586-018-2115-1","Article"
"Modular Design of Machine-Tool Equipment as Cyberphysical Systems on the Basis of Artificial Intelligence and Cloud Technology for Digital Production","Russian Engineering Research","","39","4","10.3103/S1068798X19040099","Yu. G. KabaldinD. A. ShataginP. V. KolchinR. Sh. Mansurov","2019","http://link.springer.com/article/10.3103/S1068798X19040099","Article"
"Classification of sentence level sentiment analysis using cloud machine learning techniques","Cluster Computing","","22","1","10.1007/s10586-017-1200-1","R. ArulmuruganK. R. SabarmathiH. Anandakumar","2019","http://link.springer.com/article/10.1007/s10586-017-1200-1","Article"
"A domain-divided configurable security model for cloud computing-based telecommunication services","The Journal of Supercomputing","","75","1","10.1007/s11227-015-1587-5","Jinan ShenDeqing ZouHai JinBin YuanWeiqi Dai","2019","http://link.springer.com/article/10.1007/s11227-015-1587-5","Article"
"Forming High-Availability Cloud Mechanism for Secure Peer-Servicing Networks","Wireless Personal Communications","","109","1","10.1007/s11277-019-06569-7","Tung-Ying LeeYin-Jun ChenGwo-Jiun Horng","2019","http://link.springer.com/article/10.1007/s11277-019-06569-7","Article"
"Enhancing application performance via DAG-driven scheduling in task parallelism for cloud center","Peer-to-Peer Networking and Applications","","12","2","10.1007/s12083-017-0576-2","Chenxi LiXiaofei LiaoHai Jin","2019","http://link.springer.com/article/10.1007/s12083-017-0576-2","Article"
"Cloud-Based Materials and Product Realization—Fostering ICME Via Industry 4.0","Integrating Materials and Manufacturing Innovation","","8","2","10.1007/s40192-019-00139-2","Anand Balu NellippallilZhenjun MingJanet K. AllenFarrokh Mistree","2019","http://link.springer.com/article/10.1007/s40192-019-00139-2","Article"
"A Lightweight User Authentication Scheme for Cloud-IoT Based Healthcare Services","Iranian Journal of Science and Technology, Transactions of Electrical Engineering","","43","1","10.1007/s40998-018-0146-5","Geeta SharmaSheetal Kalra","2019","http://link.springer.com/article/10.1007/s40998-018-0146-5","Article"
"Mobile cloud computing for indoor emergency response: the IPSOS assistant case study","Journal of Reliable Intelligent Environments","","5","3","10.1007/s40860-019-00088-9","Dario FacchinettiGiuseppe PsailaPatrizia Scandurra","2019","http://link.springer.com/article/10.1007/s40860-019-00088-9","Article"
"Software microbenchmarking in the cloud. How bad is it really?","Empirical Software Engineering","","24","4","10.1007/s10664-019-09681-1","Christoph LaaberJoel ScheunerPhilipp Leitner","2019","http://link.springer.com/article/10.1007/s10664-019-09681-1","Article"
"Assessment of Cognitive skills via Human-robot Interaction and Cloud Computing","Journal of Bionic Engineering","","16","3","10.1007/s42235-019-0043-2","Alessandro Di NuovoSimone VarrasiAlexandr LucasDaniela ContiJohn McNamaraAlessandro Soranzo","2019","http://link.springer.com/article/10.1007/s42235-019-0043-2","Article"
"An intelligent CNC controller using cloud knowledge base","The International Journal of Advanced Manufacturing Technology","","102","1 - 4","10.1007/s00170-018-03222-8","Wenbin GaoChengrui ZhangTianliang HuYingxin Ye","2019","http://link.springer.com/article/10.1007/s00170-018-03222-8","Article"
"SAVE: self-adaptive consolidation of virtual machines for energy efficiency of CPU-intensive applications in the cloud","The Journal of Supercomputing","","75","11","10.1007/s11227-019-02927-1","Wenxia GuoPing KuangYaqiu JiangXiang XuWenhong Tian","2019","http://link.springer.com/article/10.1007/s11227-019-02927-1","Article"
"Reproducible biomedical benchmarking in the cloud: lessons from crowd-sourced data challenges","Genome Biology","","20","1","10.1186/s13059-019-1794-0","Kyle EllrottAlex BuchananAllison CreasonMichael MasonThomas SchaffterBruce HoffJames EddyJohn M. ChiltonThomas YuJoshua M. StuartJulio Saez-RodriguezGustavo StolovitzkyPaul C. BoutrosJustin Guinney","2019","http://link.springer.com/article/10.1186/s13059-019-1794-0","Article"
"Histogram difference with Fuzzy rule base modeling for gradual shot boundary detection in video cloud applications","Cluster Computing","","22","1","10.1007/s10586-017-1201-0","A. Kethsy PrabavathyJ. Devi Shree","2019","http://link.springer.com/article/10.1007/s10586-017-1201-0","Article"
"Catering to Real-Time Requirements of Cloud-Connected Mobile Manipulators","KI - Künstliche Intelligenz","","33","2","10.1007/s13218-019-00581-6","Christoph WalterJulian-Benedikt ScholleNorbert Elkmann","2019","http://link.springer.com/article/10.1007/s13218-019-00581-6","Article"
"A Novel Securable Fuzzy Logic Based Ranking Scheme for Document Searching on Outsourced Cloud Data","Wireless Personal Communications","","105","1","10.1007/s11277-018-6108-4","S. N. ManoharanK. Ruba Soundar","2019","http://link.springer.com/article/10.1007/s11277-018-6108-4","Article"
"Strategies of structural health monitoring for bridges based on cloud computing","Journal of Civil Structural Health Monitoring","","9","5","10.1007/s13349-019-00356-5","Marco FuringhettiAlberto PaveseFrancesco LunghiDavide Silvestri","2019","http://link.springer.com/article/10.1007/s13349-019-00356-5","Article"
"Application of multivariate Gaussian model for discovery of healthcare services in cloud","Cluster Computing","","22","2","10.1007/s10586-018-1935-3","S. BhamaG. R. Karpagam","2019","http://link.springer.com/article/10.1007/s10586-018-1935-3","Article"
"An efficient scheduling multimedia transcoding method for DASH streaming in cloud environment","Cluster Computing","","22","1","10.1007/s10586-017-1259-8","Linh Van MaJaehyung ParkJiseung NamJonghyun JangJinsul Kim","2019","http://link.springer.com/article/10.1007/s10586-017-1259-8","Article"
"Adaptive fault-tolerant scheduling strategies for mobile cloud computing","The Journal of Supercomputing","","75","8","10.1007/s11227-019-02745-5","JongHyuk LeeJoonMin Gil","2019","http://link.springer.com/article/10.1007/s11227-019-02745-5","Article"
"A novel approach to workload prediction using attention-based LSTM encoder-decoder network in cloud environment","EURASIP Journal on Wireless Communications and Networking","","2019","1","10.1186/s13638-019-1605-z","Yonghua ZhuWeilin ZhangYihai ChenHonghao Gao","2019","http://link.springer.com/article/10.1186/s13638-019-1605-z","Article"
"Price Versus Performance of Big Data Analysis for Cloud Based Internet of Things Networks","Mobile Networks and Applications","","24","3","10.1007/s11036-018-1063-6","Khalim Amjad MeerjaPraveen V. NaiduSri Rama Krishna Kalva","2019","http://link.springer.com/article/10.1007/s11036-018-1063-6","Article"
"Automated Framework for Screening of Glaucoma Through Cloud Computing","Journal of Medical Systems","","43","5","10.1007/s10916-019-1260-2","M. SooryaAshish IssacMalay Kishore Dutta","2019","http://link.springer.com/article/10.1007/s10916-019-1260-2","Article"
"Hybrid mist-cloud systems for large scale geospatial big data analytics and processing: opportunities and challenges","Arabian Journal of Geosciences","","12","2","10.1007/s12517-018-4104-3","Rabindra Kumar BarikChinmaya MisraRakesh K. LenkaHarishchandra DubeyKunal Mankodiya","2019","http://link.springer.com/article/10.1007/s12517-018-4104-3","Article"
"A Mathematical Network Model and a Solution Algorithm for IaaS Cloud Computing","Networks and Spatial Economics","","","","10.1007/s11067-019-09460-x","Gabriella ColajanniPatrizia Daniele","2019","http://link.springer.com/article/10.1007/s11067-019-09460-x","Article"
"Parallel computing in bioinformatics: a view from high-performance, heterogeneous, and cloud computing","The Journal of Supercomputing","","75","7","10.1007/s11227-019-02934-2","Miguel A. Vega-RodríguezSergio Santander-Jiménez","2019","http://link.springer.com/article/10.1007/s11227-019-02934-2","Article"
"Distributed denial of service (DDoS) attack mitigation in software defined network (SDN)-based cloud computing environment","Journal of Ambient Intelligence and Humanized Computing","","10","5","10.1007/s12652-018-0800-9","Kriti BhushanB. B. Gupta","2019","http://link.springer.com/article/10.1007/s12652-018-0800-9","Article"
"An improved Lévy based whale optimization algorithm for bandwidth-efficient virtual machine placement in cloud computing environment","Cluster Computing","","22","4","10.1007/s10586-018-1769-z","Mohamed Abdel-BassetLaila Abdle-FatahArun Kumar Sangaiah","2019","http://link.springer.com/article/10.1007/s10586-018-1769-z","Article"
"An efficient model for vehicular cloud computing with prioritizing computing resources","Peer-to-Peer Networking and Applications","","12","5","10.1007/s12083-018-0677-6","Masoud TahmasebiMohammad Reza Khayyambashi","2019","http://link.springer.com/article/10.1007/s12083-018-0677-6","Article"
"The impact of the hybrid platform of internet of things and cloud computing on healthcare systems: opportunities, challenges, and open problems","Journal of Ambient Intelligence and Humanized Computing","","10","10","10.1007/s12652-017-0659-1","Ashraf DarwishAboul Ella HassanienMohamed ElhosenyArun Kumar SangaiahKhan Muhammad","2019","http://link.springer.com/article/10.1007/s12652-017-0659-1","Article"
"Membrane computing inspired protocol to enhance security in cloud network","The Journal of Supercomputing","","75","4","10.1007/s11227-018-2629-6","K. MaharajanB. Paramasivan","2019","http://link.springer.com/article/10.1007/s11227-018-2629-6","Article"
"Characterization of sparse beamforming for energy efficiency in cloud radio access networks using Gauss–Poisson process","Wireless Networks","","25","8","10.1007/s11276-018-1752-x","Majid FarahmandAbbas Mohammadi","2019","http://link.springer.com/article/10.1007/s11276-018-1752-x","Article"
"DDoS prevention using third party auditor in cloud computing","Iran Journal of Computer Science","","2","4","10.1007/s42044-019-00039-w","Rajat SaxenaSomnath Dey","2019","http://link.springer.com/article/10.1007/s42044-019-00039-w","Article"
"Mobility-aware task delegation model in mobile cloud computing","The Journal of Supercomputing","","75","1","10.1007/s11227-018-02729-x","Anwesha MukherjeeDeepsubhra Guha RoyDebashis De","2019","http://link.springer.com/article/10.1007/s11227-018-02729-x","Article"
"Cloud computing as a facilitator for web service composition in factory automation","Journal of Intelligent Manufacturing","","30","2","10.1007/s10845-016-1277-z","Juha PuttonenAndrei LobovMaria A. Cavia SotoJosé L. Martinez Lastra","2019","http://link.springer.com/article/10.1007/s10845-016-1277-z","Article"
"Chatbot-based heathcare service with a knowledge base for cloud computing","Cluster Computing","","22","1","10.1007/s10586-018-2334-5","Kyungyong ChungRoy C. Park","2019","http://link.springer.com/article/10.1007/s10586-018-2334-5","Article"
"Optimizing Applications for Mobile Cloud Computing Through MOCCAA","Journal of Grid Computing","","17","4","10.1007/s10723-019-09492-0","Harun BarakiAlexander JahlStefan JakobCorvin SchwarzbachMalte FaxKurt Geihs","2019","http://link.springer.com/article/10.1007/s10723-019-09492-0","Article"
"Optimized state update for mobile games in cloud networks","Cluster Computing","","22","1","10.1007/s10586-017-1220-x","Hye-Young KimKuinam J. Kim","2019","http://link.springer.com/article/10.1007/s10586-017-1220-x","Article"
"VM Reservation Plan Adaptation Using Machine Learning in Cloud Computing","Journal of Grid Computing","","17","4","10.1007/s10723-019-09487-x","Bartlomiej SniezynskiPiotr NawrockiMichal WilkMarcin JarzabKrzysztof Zielinski","2019","http://link.springer.com/article/10.1007/s10723-019-09487-x","Article"
"Enhancing the security of cloud data using hybrid encryption algorithm","Journal of Ambient Intelligence and Humanized Computing","","","","10.1007/s12652-019-01403-1","K. R. SajaySuvanam Sasidhar BabuYellepeddi Vijayalakshmi","2019","http://link.springer.com/article/10.1007/s12652-019-01403-1","Article"
"Pareto-optimal cost optimization for large scale cloud systems using joint allocation of resources","Journal of Ambient Intelligence and Humanized Computing","","","","10.1007/s12652-019-01601-x","Suchintan MishraArun Kumar SangaiahManmath Narayan SahooSambit Bakshi","2019","http://link.springer.com/article/10.1007/s12652-019-01601-x","Article"
"Toward maximization of profit and quality of cloud federation: solution to cloud federation formation problem","The Journal of Supercomputing","","75","2","10.1007/s11227-018-2620-2","Benay Kumar RayAvirup SahaSunirmal KhatuaSarbani Roy","2019","http://link.springer.com/article/10.1007/s11227-018-2620-2","Article"
"Reliability and energy efficient workflow scheduling in cloud environment","Cluster Computing","","22","4","10.1007/s10586-019-02911-7","Ritu GargMamta MittalLe Hoang Son","2019","http://link.springer.com/article/10.1007/s10586-019-02911-7","Article"
"A focus on future cloud: machine learning-based cloud security","Service Oriented Computing and Applications","","13","3","10.1007/s11761-019-00270-0","E. K. SubramanianLatha Tamilselvan","2019","http://link.springer.com/article/10.1007/s11761-019-00270-0","Article"
"Towards a cloud-based automated surveillance system using wireless technologies","Multimedia Systems","","25","5","10.1007/s00530-017-0558-5","Javier J. Salmerón-GarcíaSjoerd van den DriesFernando Díaz-del-RíoArturo Morgado-EstevezJose Luis Sevillano-RamosM. J. G. van de Molengraft","2019","http://link.springer.com/article/10.1007/s00530-017-0558-5","Article"
"Cost-efficient parallel processing of irregularly structured problems in cloud computing environments","Cluster Computing","","22","3","10.1007/s10586-018-2879-3","Jens HaussmannWolfgang BlochingerWolfgang Kuechlin","2019","http://link.springer.com/article/10.1007/s10586-018-2879-3","Article"
"Towards Sustainable High-Performance Transaction Processing in Cloud-based DBMS","Cluster Computing","","22","1","10.1007/s10586-018-2826-3","Woong SulHeon Y. YeomHyungsoo Jung","2019","http://link.springer.com/article/10.1007/s10586-018-2826-3","Article"
"AGCM: Active Queue Management-Based Green Cloud Model for Mobile Edge Computing","Wireless Personal Communications","","105","3","10.1007/s11277-019-06119-1","Alshimaa H. IsmailNirmeen A. El-BahnasawyHesham F. A. Hamed","2019","http://link.springer.com/article/10.1007/s11277-019-06119-1","Article"
"Optimal Task Assignment in Mobile Cloud Computing by Queue Based Ant-Bee Algorithm","Wireless Personal Communications","","104","1","10.1007/s11277-018-6014-9","Vinu Sundararaj","2019","http://link.springer.com/article/10.1007/s11277-018-6014-9","Article"
"A Data Security Storage Method for IoT Under Hadoop Cloud Computing Platform","International Journal of Wireless Information Networks","","26","3","10.1007/s10776-019-00434-x","Yuqing Mo","2019","http://link.springer.com/article/10.1007/s10776-019-00434-x","Article"
"Toward collaborative open data science in metabolomics using Jupyter Notebooks and cloud computing","Metabolomics","","15","10","10.1007/s11306-019-1588-0","Kevin M. MendezLeighton PritchardStacey N. ReinkeDavid I. Broadhurst","2019","http://link.springer.com/article/10.1007/s11306-019-1588-0","Article"
"Hybrid Cloud Adaptive Scheduling Strategy for Heterogeneous Workloads","Journal of Grid Computing","","17","3","10.1007/s10723-019-09481-3","Li ChunlinTang JianhangLuo Youlong","2019","http://link.springer.com/article/10.1007/s10723-019-09481-3","Article"
"A comprehensive framework for student stress monitoring in fog-cloud IoT environment: m-health perspective","Medical & Biological Engineering & Computing","","57","1","10.1007/s11517-018-1877-1","Prabal VermaSandeep K Sood","2019","http://link.springer.com/article/10.1007/s11517-018-1877-1","Article"
"Susceptibility zoning of karst geological hazards using machine learning and cloud model","Cluster Computing","","22","4","10.1007/s10586-017-1590-0","Jia XingliDai QingmiaoYang Hongzhi","2019","http://link.springer.com/article/10.1007/s10586-017-1590-0","Article"
"An Energy-Efficient Dynamic Resource Management Approach Based on Clustering and Meta-Heuristic Algorithms in Cloud Computing IaaS Platforms","Wireless Personal Communications","","104","4","10.1007/s11277-018-6089-3","Maryam Askarizade HaghighiMehrdad MaeenMajid Haghparast","2019","http://link.springer.com/article/10.1007/s11277-018-6089-3","Article"
"A hybrid approach to scheduling real-time IoT workflows in fog and cloud environments","Multimedia Tools and Applications","","78","17","10.1007/s11042-018-7051-9","Georgios L. StavrinidesHelen D. Karatza","2019","http://link.springer.com/article/10.1007/s11042-018-7051-9","Article"
"Agricultural product monitoring system supported by cloud computing","Cluster Computing","","22","4","10.1007/s10586-018-2022-5","Chen JinboCao XiangliangFu Han-ChiAnthony Lam","2019","http://link.springer.com/article/10.1007/s10586-018-2022-5","Article"
"Autonomous multimedia cluster computing based on Cooperative Cognition data behavior measurement under multi cloud computing","Multimedia Tools and Applications","","78","7","10.1007/s11042-018-6381-y","Ying XiaoLi ZhangLigong Hou","2019","http://link.springer.com/article/10.1007/s11042-018-6381-y","Article"
"A water cycle optimized wavelet neural network algorithm for demand prediction in cloud computing","Cluster Computing","","22","4","10.1007/s10586-019-02916-2","Sima JeddiSaeed Sharifian","2019","http://link.springer.com/article/10.1007/s10586-019-02916-2","Article"
"Integer linear programming-based multi-objective scheduling for scientific workflows in multi-cloud environments","The Journal of Supercomputing","","75","10","10.1007/s11227-019-02877-8","Somayeh MohammadiLatif PourKarimiHossein Pedram","2019","http://link.springer.com/article/10.1007/s11227-019-02877-8","Article"
"Enhanced fault identification and optimal task prediction (EFIOTP) algorithm during multi-resource utilization in cloud-based knowledge and personal computing","Personal and Ubiquitous Computing","","","","10.1007/s00779-019-01265-6","J. M. NandhiniT. Gnanasekaran","2019","http://link.springer.com/article/10.1007/s00779-019-01265-6","Article"
"Multidimensional hierarchical VM migration management for HPC cloud environments","The Journal of Supercomputing","","75","8","10.1007/s11227-019-02799-5","Sonja FiliposkaAnastas MishevKatja Gilly","2019","http://link.springer.com/article/10.1007/s11227-019-02799-5","Article"
"Adaptive PID controller for cloud smart city system stability control based on chaotic neural network","Cluster Computing","","22","6","10.1007/s10586-017-1197-5","Xuebiao ZhuKuisheng ChenYanan WangHuasheng Zheng","2019","http://link.springer.com/article/10.1007/s10586-017-1197-5","Article"
