Item Title,Publication Title,Book Series Title,Journal Volume,Journal Issue,Item DOI,Authors,Publication Year,URL,Content Type
"Efficient and Secure Privacy Analysis for Medical Big Data Using TDES and MKSVM with Access Control in Cloud","Journal of Medical Systems","","43","8","10.1007/s10916-019-1374-6","E. ShanmugapriyaR. Kavitha","2019","http://link.springer.com/article/10.1007/s10916-019-1374-6","Article"
"Cloud platform wireless sensor network detection system based on data sharing","Cluster Computing","","22","6","10.1007/s10586-018-2260-6","Shuo XiaoTianxu LiBin GuoZhenzhen Huang","2019","http://link.springer.com/article/10.1007/s10586-018-2260-6","Article"
"Parameter optimization criteria guided 3D point cloud classification","Multimedia Tools and Applications","","78","4","10.1007/s11042-018-6838-z","Hongjun LiWeiliang MengXinying LiuShiming XiangXiaopeng Zhang","2019","http://link.springer.com/article/10.1007/s11042-018-6838-z","Article"
"LP-WSC: a linear programming approach for web service composition in geographically distributed cloud environments","The Journal of Supercomputing","","75","5","10.1007/s11227-018-2656-3","Mostafa Ghobaei-AraniAlireza Souri","2019","http://link.springer.com/article/10.1007/s11227-018-2656-3","Article"
"$$FC^{2}$$
                
                  
                    
                      F
                      
                        C
                        2
                      
                    
                  
                
              : cloud-based cluster provisioning for distributed machine learning","Cluster Computing","","22","4","10.1007/s10586-019-02912-6","Nguyen Binh Duong Ta","2019","http://link.springer.com/article/10.1007/s10586-019-02912-6","Article"
"VMBKS: a shared memory cache system based on booting kernel in cloud","The Journal of Supercomputing","","75","1","10.1007/s11227-015-1554-1","Xiang ShiXiaofei LiaoDayang ZhengHai JinHaikun Liu","2019","http://link.springer.com/article/10.1007/s11227-015-1554-1","Article"
"A Green energy-efficient scheduler for cloud data centers","Cluster Computing","","22","2","10.1007/s10586-018-2028-z","Mohammed AmoonTarek E. El. Tobely","2019","http://link.springer.com/article/10.1007/s10586-018-2028-z","Article"
"On construction of a cloud storage system with heterogeneous software-defined storage technologies","Human-centric Computing and Information Sciences","","9","1","10.1186/s13673-019-0173-x","Chao-Tung YangShuo-Tsung ChenYu-Wei ChanYu-Chuan Shen","2019","http://link.springer.com/article/10.1186/s13673-019-0173-x","Article"
"A novel method for adaptive fault tolerance during load balancing in cloud computing","Cluster Computing","","22","5","10.1007/s10586-017-1038-6","T. TamilvizhiB. Parvathavarthini","2019","http://link.springer.com/article/10.1007/s10586-017-1038-6","Article"
"Factors affecting cloud computing adoption in the Indian school education system","Education and Information Technologies","","24","4","10.1007/s10639-019-09878-3","Jewan SinghVibhakar Mansotra","2019","http://link.springer.com/article/10.1007/s10639-019-09878-3","Article"
"Failure detectors for crash faults in cloud","Journal of Ambient Intelligence and Humanized Computing","","10","11","10.1007/s12652-018-1121-8","Bharati SinhaAwadhesh Kumar SinghPoonam Saini","2019","http://link.springer.com/article/10.1007/s12652-018-1121-8","Article"
"Research on process customization technology for intelligent transportation cloud service platform","Cluster Computing","","22","6","10.1007/s10586-018-2555-7","Hua PanZhongxiang HuangZengzhen He","2019","http://link.springer.com/article/10.1007/s10586-018-2555-7","Article"
"A Cognizant agent system for optimizing cloud service searching strategy","Cluster Computing","","22","6","10.1007/s10586-018-1915-7","S. DhanasekaranV. Vasudevan","2019","http://link.springer.com/article/10.1007/s10586-018-1915-7","Article"
"Attribute-based hierarchical file encryption for efficient retrieval of files by DV index tree from cloud using crossover genetic algorithm","Soft Computing","","23","8","10.1007/s00500-019-03790-1","R. NareshM. SayeekumarG. M. KarthickP. Supraja","2019","http://link.springer.com/article/10.1007/s00500-019-03790-1","Article"
"A new agent-based method for QoS-aware cloud service composition using particle swarm optimization algorithm","Journal of Ambient Intelligence and Humanized Computing","","10","5","10.1007/s12652-018-0773-8","Afshin NaseriNima Jafari Navimipour","2019","http://link.springer.com/article/10.1007/s12652-018-0773-8","Article"
"MaReIA: a cloud MapReduce based high performance whole slide image analysis framework","Distributed and Parallel Databases","","37","2","10.1007/s10619-018-7237-1","Hoang VoJun KongDejun TengYanhui LiangAblimit AjiGeorge TeodoroFusheng Wang","2019","http://link.springer.com/article/10.1007/s10619-018-7237-1","Article"
"Multi-cloud cooperative intrusion detection system: trust and fairness assurance","Annals of Telecommunications","","74","9 - 10","10.1007/s12243-019-00724-8","Adel AbusittaMartine BellaicheMichel Dagenais","2019","http://link.springer.com/article/10.1007/s12243-019-00724-8","Article"
"Cloud-based parallel power flow calculation using resilient distributed datasets and directed acyclic graph","Journal of Modern Power Systems and Clean Energy","","7","1","10.1007/s40565-018-0406-4","Dewen WANGFangfang ZHOUJiangman LI","2019","http://link.springer.com/article/10.1007/s40565-018-0406-4","Article"
"LCCFS: a lightweight distributed file system for cloud computing without journaling and metadata services","Science China Information Sciences","","62","7","10.1007/s11432-017-9295-4","Li WangJingling XueXiangke LiaoYunchuan WenMin Chen","2019","http://link.springer.com/article/10.1007/s11432-017-9295-4","Article"
"An efficient method for meteorological nephogram recognition in cloud environment","EURASIP Journal on Wireless Communications and Networking","","2019","1","10.1186/s13638-019-1611-1","Tao LiLei WangYongjun RenXiang LiJinyue XiaRan An","2019","http://link.springer.com/article/10.1186/s13638-019-1611-1","Article"
"Spark-IDPP: high-throughput and scalable prediction of intrinsically disordered protein regions with Spark clusters on the Cloud","Cluster Computing","","22","2","10.1007/s10586-018-2857-9","Bożena Małysiak-MrozekTomasz BaronDariusz Mrozek","2019","http://link.springer.com/article/10.1007/s10586-018-2857-9","Article"
"Locality-aware process placement for parallel and distributed simulation in cloud data centers","The Journal of Supercomputing","","75","11","10.1007/s11227-019-02973-9","Saad ZaheerAsad Waqar MalikAnis Ur RahmanSafdar Abbas Khan","2019","http://link.springer.com/article/10.1007/s11227-019-02973-9","Article"
"Secure Inverted Index Based Search over Encrypted Cloud Data with User Access Rights Management","Journal of Computer Science and Technology","","34","1","10.1007/s11390-019-1903-2","Fateh BoucennaOmar NoualiSamir KechidM. Tahar Kechadi","2019","http://link.springer.com/article/10.1007/s11390-019-1903-2","Article"
"Towards efficient privacy-preserving encrypted image search in cloud computing","Soft Computing","","23","6","10.1007/s00500-017-2927-6","Yuan WangMeixia MiaoJian ShenJianfeng Wang","2019","http://link.springer.com/article/10.1007/s00500-017-2927-6","Article"
"Research on cloud computing in the resource sharing system of university library services","Evolutionary Intelligence","","12","3","10.1007/s12065-018-0195-8","Ningning SunYong LiLihua MaWenyong ChenDunn Cynthia","2019","http://link.springer.com/article/10.1007/s12065-018-0195-8","Article"
"An IoT-based task scheduling optimization scheme considering the deadline and cost-aware scientific workflow for cloud computing","EURASIP Journal on Wireless Communications and Networking","","2019","1","10.1186/s13638-019-1557-3","Xiaojin MaHonghao GaoHuahu XuMinjie Bian","2019","http://link.springer.com/article/10.1186/s13638-019-1557-3","Article"
"Nxt-Max: for supporting VDC-based maximum redundant bandwidth allocation in cloud datacenter","Cluster Computing","","22","5","10.1007/s10586-017-1683-9","Wang ShuoLi JingWang QiqiZhang Hongjie","2019","http://link.springer.com/article/10.1007/s10586-017-1683-9","Article"
"An energy-efficient task scheduling algorithm for heterogeneous cloud computing systems","Cluster Computing","","22","2","10.1007/s10586-018-2858-8","Sanjaya K. PandaPrasanta K. Jana","2019","http://link.springer.com/article/10.1007/s10586-018-2858-8","Article"
"Auto-scaling for real-time stream analytics on HPC cloud","Service Oriented Computing and Applications","","13","2","10.1007/s11761-019-00262-0","Yingchao ChengZhifeng HaoRuichu Cai","2019","http://link.springer.com/article/10.1007/s11761-019-00262-0","Article"
"Global Cloud-Resolving Models","Current Climate Change Reports","","5","3","10.1007/s40641-019-00131-0","Masaki SatohBjorn StevensFalko JudtMarat KhairoutdinovShian-Jiann LinWilliam M. PutmanPeter Düben","2019","http://link.springer.com/article/10.1007/s40641-019-00131-0","Article"
"A Novel Multi-Objective Efficient Offloading Decision Framework in Cloud Computing for Mobile Computing Applications","Wireless Personal Communications","","107","4","10.1007/s11277-019-06348-4","Shanthi Thangam ManukumarVijayalakshmi Muthuswamy","2019","http://link.springer.com/article/10.1007/s11277-019-06348-4","Article"
"Design of network threat detection and classification based on machine learning on cloud computing","Cluster Computing","","22","1","10.1007/s10586-018-1841-8","Hyunjoo KimJonghyun KimYoungsoo KimIkkyun KimKuinam J. Kim","2019","http://link.springer.com/article/10.1007/s10586-018-1841-8","Article"
"A Framework for Heterogeneous Resource Allocation in Sensor-Cloud Environment","Wireless Personal Communications","","108","1","10.1007/s11277-019-06383-1","Sunanda BoseDebangana SarkarNandini Mukherjee","2019","http://link.springer.com/article/10.1007/s11277-019-06383-1","Article"
"Storage Node Allocation Methods for Erasure Code-based Cloud Storage Systems","Arabian Journal for Science and Engineering","","44","11","10.1007/s13369-019-03983-8","Ojus Thomas LeeG. J. AkashS. D. Madhu KumarPriya Chandran","2019","http://link.springer.com/article/10.1007/s13369-019-03983-8","Article"
"Ecological strategies of tree species in the laurel forest of Tenerife (Canary Islands): an insight into cloud forest natural dynamics using long-term monitoring data","European Journal of Forest Research","","138","1","10.1007/s10342-018-1156-6","Elias GanivetOlivier FloresEduardo BalgueríasLea de NascimentoJosé Ramón ArévaloSilvia Fernández-LugoJosé Maria Fernández-Palacios","2019","http://link.springer.com/article/10.1007/s10342-018-1156-6","Article"
"Multimedia learning platform development and implementation based on cloud environment","Multimedia Tools and Applications","","78","24","10.1007/s11042-019-08187-8","Ruijiang NanHeqing Zhang","2019","http://link.springer.com/article/10.1007/s11042-019-08187-8","Article"
"Joint remote radio heads and baseband units pool resource scheduling for delay-aware traffic in cloud radio access networks","Telecommunication Systems","","71","1","10.1007/s11235-018-0506-5","Shichao LiQiuyun WangWeigang KouDengtai Tan","2019","http://link.springer.com/article/10.1007/s11235-018-0506-5","Article"
"A validation of security determinants model for cloud adoption in Saudi organisations’ context","International Journal of Information Technology","","","","10.1007/s41870-019-00360-4","Madini O. AlassafiHany F. AtlamAbdulrahman A. AlshdadiAbdullah I. AlzahraniRayed A. AlGhamdiSeyed M. Buhari","2019","http://link.springer.com/article/10.1007/s41870-019-00360-4","Article"
"A new GLoSM embedded virtual machine model for big data services in cloud storage systems","Cluster Computing","","22","1","10.1007/s10586-018-2109-z","K. Kalai ArasanP. AnandhaKumar","2019","http://link.springer.com/article/10.1007/s10586-018-2109-z","Article"
"Resource management of cloud-enabled systems using model-free reinforcement learning","Annals of Telecommunications","","74","9 - 10","10.1007/s12243-019-00720-y","Yue JinMakram BouzidDimitre KostadinovArmen Aghasaryan","2019","http://link.springer.com/article/10.1007/s12243-019-00720-y","Article"
"Detection of DoS attacks in cloud networks using intelligent rule based classification system","Cluster Computing","","22","1","10.1007/s10586-018-2181-4","Rakesh RajendranS. V. N. Santhosh KumarYogesh PalanichamyKannan Arputharaj","2019","http://link.springer.com/article/10.1007/s10586-018-2181-4","Article"
"Towards virtual machine introspection based security framework for cloud","Sādhanā","","44","2","10.1007/s12046-018-1016-6","Bhavesh BorisaniyaDhiren Patel","2019","http://link.springer.com/article/10.1007/s12046-018-1016-6","Article"
"Privacy preserving k-nearest neighbor classification over encrypted database in outsourced cloud environments","World Wide Web","","22","1","10.1007/s11280-018-0539-4","Wei WuUdaya ParampalliJian LiuMing Xian","2019","http://link.springer.com/article/10.1007/s11280-018-0539-4","Article"
"Analysis of load balancing in cloud data centers","Journal of Ambient Intelligence and Humanized Computing","","","","10.1007/s12652-018-1106-7","Sweekriti M. ShettySudheer Shetty","2019","http://link.springer.com/article/10.1007/s12652-018-1106-7","Article"
"ECPM: an energy-efficient cloudlet placement method in mobile cloud environment","EURASIP Journal on Wireless Communications and Networking","","2019","1","10.1186/s13638-019-1455-8","Chao ShenShengjun XueShucun Fu","2019","http://link.springer.com/article/10.1186/s13638-019-1455-8","Article"
"Proof of violation for response time auditing in cloud systems","The Journal of Supercomputing","","75","1","10.1007/s11227-015-1555-0","Gwan-Hwan HwangYi-Ling Yuan","2019","http://link.springer.com/article/10.1007/s11227-015-1555-0","Article"
"An optimization approach to capacity evaluation and investment decision of hybrid cloud: a corporate customer’s perspective","Journal of Cloud Computing","","8","1","10.1186/s13677-019-0140-0","In Lee","2019","http://link.springer.com/article/10.1186/s13677-019-0140-0","Article"
"Experts reviews of a cloud forensic readiness framework for organizations","Journal of Cloud Computing","","8","1","10.1186/s13677-019-0133-z","Ahmed AleneziHany F. AtlamGary B. Wills","2019","http://link.springer.com/article/10.1186/s13677-019-0133-z","Article"
"Context-aware adaptive resource provisioning for mobile clients in intra-cloud environment","Cluster Computing","","22","4","10.1007/s10586-018-1945-1","S. DurgaS. MohanJ. Dinesh PeterS. Surya","2019","http://link.springer.com/article/10.1007/s10586-018-1945-1","Article"
"Emerging Solutions in Big Data and Cloud Technologies for Mobile Networks","Mobile Networks and Applications","","24","3","10.1007/s11036-019-01229-3","Vijayakumar VaradarajanVenkataraman NeelanarayananRon DoyleImad Fakhri Al-ShaikhliSven Groppe","2019","http://link.springer.com/article/10.1007/s11036-019-01229-3","Article"
"Locality sensitive request distribution for fog and cloud servers","Service Oriented Computing and Applications","","13","2","10.1007/s11761-019-00260-2","Olamilekan FadahunsiMuthucumaru Maheswaran","2019","http://link.springer.com/article/10.1007/s11761-019-00260-2","Article"
"A Multi-objective Optimal Task Scheduling in Cloud Environment Using Cuckoo Particle Swarm Optimization","Wireless Personal Communications","","109","1","10.1007/s11277-019-06566-w","T. Prem JacobK. Pradeep","2019","http://link.springer.com/article/10.1007/s11277-019-06566-w","Article"
"Performability Evaluation of a Cloud-Based Disaster Recovery Solution for IT Environments","Journal of Grid Computing","","17","3","10.1007/s10723-018-9446-2","Ermeson AndradeBruno Nogueira","2019","http://link.springer.com/article/10.1007/s10723-018-9446-2","Article"
"Automatic content extraction and time-aware topic clustering for large-scale social network on cloud platform","The Journal of Supercomputing","","75","5","10.1007/s11227-018-2704-z","Chunlin LiJingpan Bai","2019","http://link.springer.com/article/10.1007/s11227-018-2704-z","Article"
"Continuous security assessment of cloud based applications using distributed hashing algorithm in SDLC","Cluster Computing","","22","5","10.1007/s10586-017-1176-x","K. VijayakumarC. Arun","2019","http://link.springer.com/article/10.1007/s10586-017-1176-x","Article"
"Hybrid Parallel Linguistic Fuzzy Rules with Canopy MapReduce for Big Data Classification in Cloud","International Journal of Fuzzy Systems","","21","3","10.1007/s40815-018-0597-x","V. VennilaA. Rajiv Kannan","2019","http://link.springer.com/article/10.1007/s40815-018-0597-x","Article"
"An Online Cost-Based Job Scheduling Method by Cellular Automata in Cloud Computing Environment","Wireless Personal Communications","","105","3","10.1007/s11277-019-06128-0","Neda ZekrizadehAhmad KhademzadehMehdi Hosseinzadeh","2019","http://link.springer.com/article/10.1007/s11277-019-06128-0","Article"
"A strategic performance of virtual task scheduling in multi cloud environment","Cluster Computing","","22","4","10.1007/s10586-017-1268-7","C. ThirumalaiselvanV. Venkatachalam","2019","http://link.springer.com/article/10.1007/s10586-017-1268-7","Article"
"Resource stealing: a resource multiplexing method for mix workloads in cloud system","The Journal of Supercomputing","","75","1","10.1007/s11227-015-1609-3","Yusong TanFuhui WuQingbo WuXiangke Liao","2019","http://link.springer.com/article/10.1007/s11227-015-1609-3","Article"
"Version-vector based video data online cloud backup in smart campus","Multimedia Tools and Applications","","78","3","10.1007/s11042-018-6106-2","Ming TaoWenhong WeiHuaqiang YuanShuqiang Huang","2019","http://link.springer.com/article/10.1007/s11042-018-6106-2","Article"
"Dynamic heterogeneous shortest job first (DHSJF): a task scheduling approach for heterogeneous cloud computing systems","International Journal of Information Technology","","11","4","10.1007/s41870-018-0156-6","Sonam SethNipur Singh","2019","http://link.springer.com/article/10.1007/s41870-018-0156-6","Article"
"Virtual machine placement quality estimation in cloud infrastructures using integer linear programming","Software Quality Journal","","27","2","10.1007/s11219-018-9420-z","Jorge LópezNatalia KushikDjamal Zeghlache","2019","http://link.springer.com/article/10.1007/s11219-018-9420-z","Article"
"Communication and computation cooperation in cloud radio access network with mobile edge computing","CCF Transactions on Networking","","2","1","10.1007/s42045-018-0006-x","Tong LiKezhi WangKe XuKun YangChathura Sarathchandra MagurawalageHaiyang Wang","2019","http://link.springer.com/article/10.1007/s42045-018-0006-x","Article"
"Dynamic scheduling applying new population grouping of whales meta-heuristic in cloud computing","The Journal of Supercomputing","","75","10","10.1007/s11227-019-02832-7","Farinaz Hemasian-EtefaghFaramarz Safi-Esfahani","2019","http://link.springer.com/article/10.1007/s11227-019-02832-7","Article"
"TOPSIS–PSO inspired non-preemptive tasks scheduling algorithm in cloud environment","Cluster Computing","","22","4","10.1007/s10586-019-02915-3","Neelam PanwarSarita NegiMan Mohan Singh RauthanKunwar Singh Vaisla","2019","http://link.springer.com/article/10.1007/s10586-019-02915-3","Article"
"A secure cloud-based solution for real-time monitoring and management of Internet of underwater things (IOUT)","Neural Computing and Applications","","31","1","10.1007/s00521-018-3774-9","M. P. GopinathG. S. TamizharasiL. KavisankarR. SathyarajS. KarthiS. L. AarthyB. Balamurugan","2019","http://link.springer.com/article/10.1007/s00521-018-3774-9","Article"
"Multi-security-level cloud storage system based on improved proxy re-encryption","EURASIP Journal on Wireless Communications and Networking","","2019","1","10.1186/s13638-019-1614-y","Jinan ShenXuejian DengZhenwu Xu","2019","http://link.springer.com/article/10.1186/s13638-019-1614-y","Article"
"Risks and rewards of cloud computing in the UK public sector: A reflection on three Organisational case studies","Information Systems Frontiers","","21","2","10.1007/s10796-017-9756-0","Steve JonesZahir IraniUthayasankar SivarajahPeter E. D. Love","2019","http://link.springer.com/article/10.1007/s10796-017-9756-0","Article"
"Efficient resource provisioning for elastic Cloud services based on machine learning techniques","Journal of Cloud Computing","","8","1","10.1186/s13677-019-0128-9","Rafael Moreno-VozmedianoRubén S. MonteroEduardo HuedoIgnacio M. Llorente","2019","http://link.springer.com/article/10.1186/s13677-019-0128-9","Article"
"Replica-aware task scheduling and load balanced cache placement for delay reduction in multi-cloud environment","The Journal of Supercomputing","","75","5","10.1007/s11227-018-2695-9","Chunlin LiJing ZhangHengliang Tang","2019","http://link.springer.com/article/10.1007/s11227-018-2695-9","Article"
"On Maximum Elastic Scheduling in Cloud-Based Data Center Networks for Virtual Machines with the Hose Model","Journal of Computer Science and Technology","","34","1","10.1007/s11390-019-1890-3","Shuai-Bing LuJie WuHuan-Yang ZhengZhi-Yi Fang","2019","http://link.springer.com/article/10.1007/s11390-019-1890-3","Article"
"A time series forecasting based on cloud model similarity measurement","Soft Computing","","23","14","10.1007/s00500-018-3190-1","Gaowei YanSongda JiaJie DingXinying XuYusong Pang","2019","http://link.springer.com/article/10.1007/s00500-018-3190-1","Article"
"RDDSACCGA: a reliable data distribution solution assisted by cloud computing based on genetic algorithm","Cluster Computing","","22","5","10.1007/s10586-017-1299-0","Wei ZhangXinchang ZhangHuiling ShiLongquan Zhou","2019","http://link.springer.com/article/10.1007/s10586-017-1299-0","Article"
"Cloud Service Security Adaptive Target Detection Algorithm Based on Bio-Inspired Performance Evaluation Process Algebra","Wuhan University Journal of Natural Sciences","","24","3","10.1007/s11859-019-1384-8","Guosheng ZhaoXiaofeng QuYuting LiaoTiantian WangJingting Zhang","2019","http://link.springer.com/article/10.1007/s11859-019-1384-8","Article"
"Public “Cloud” Provisioning for Venus Express VMC Image Processing","Communications on Applied Mathematics and Computation","","1","2","10.1007/s42967-019-00014-z","J. L. Vázquez-PolettiM. P. VelascoS. JiménezD. UseroI. M. LlorenteL. VázquezO. KorablevD. BelyaevM. V. PatsaevaI. V. Khatuntsev","2019","http://link.springer.com/article/10.1007/s42967-019-00014-z","Article"
"ECC Based Secure Sharing of Healthcare Data in the Health Cloud Environment","Wireless Personal Communications","","108","2","10.1007/s11277-019-06450-7","V. Sri Vigna HemaRamesh Kesavan","2019","http://link.springer.com/article/10.1007/s11277-019-06450-7","Article"
"Network flow analysis for detection and mitigation of Fraudulent Resource Consumption (FRC) attacks in multimedia cloud computing","Multimedia Tools and Applications","","78","4","10.1007/s11042-017-5522-z","Kriti BhushanBrij B. Gupta","2019","http://link.springer.com/article/10.1007/s11042-017-5522-z","Article"
"A hybrid grey wolf optimizer algorithm with evolutionary operators for optimal QoS-aware service composition and optimal selection in cloud manufacturing","The International Journal of Advanced Manufacturing Technology","","101","9 - 12","10.1007/s00170-018-3028-0","Hamed BouzaryF. Frank Chen","2019","http://link.springer.com/article/10.1007/s00170-018-3028-0","Article"
"Optimal computing resource allocation algorithm in cloud computing based on hybrid differential parallel scheduling","Cluster Computing","","22","3","10.1007/s10586-018-2138-7","Jing WeiXin-fa Zeng","2019","http://link.springer.com/article/10.1007/s10586-018-2138-7","Article"
"Smart elastic scheduling algorithm for virtual machine migration in cloud computing","The Journal of Supercomputing","","75","7","10.1007/s11227-019-02748-2","Heba NashaatNesma AshryRawya Rizk","2019","http://link.springer.com/article/10.1007/s11227-019-02748-2","Article"
"Security concerns and countermeasures in cloud computing: a qualitative analysis","International Journal of Information Technology","","11","4","10.1007/s41870-018-0108-1","AnjanaAjit Singh","2019","http://link.springer.com/article/10.1007/s41870-018-0108-1","Article"
"3D scene reconstruction of landslide topography based on data fusion between laser point cloud and UAV image","Environmental Earth Sciences","","78","17","10.1007/s12665-019-8516-5","Haowei JiXianqi Luo","2019","http://link.springer.com/article/10.1007/s12665-019-8516-5","Article"
"Biometric authentication and image encryption for image security in cloud framework","Multiscale and Multidisciplinary Modeling, Experiments and Design","","2","4","10.1007/s41939-019-00049-y","Vishruti KakkadMeshwa PatelManan Shah","2019","http://link.springer.com/article/10.1007/s41939-019-00049-y","Article"
"Secure and efficient proxy re-encryption scheme based on key-homomorphic constrained PRFs in cloud computing","Cluster Computing","","22","2","10.1007/s10586-018-2862-z","Wei LuoWenping Ma","2019","http://link.springer.com/article/10.1007/s10586-018-2862-z","Article"
"An optimized service broker routing policy based on differential evolution algorithm in fog/cloud environment","Cluster Computing","","22","1","10.1007/s10586-017-1559-z","Ahmad M. ManasrahAla’a AldomiB. B. Gupta","2019","http://link.springer.com/article/10.1007/s10586-017-1559-z","Article"
"IoT and cloud computing based automatic epileptic seizure detection using HOS features based random forest classification","Journal of Ambient Intelligence and Humanized Computing","","","","10.1007/s12652-019-01613-7","Kuldeep SinghJyoteesh Malhotra","2019","http://link.springer.com/article/10.1007/s12652-019-01613-7","Article"
